{
  "scenarioType": "SC-03",

  "planningContext": {
    "horizon": {
      "dateDebut": "2026-05-11",
      "dateFin": "2026-05-17"
    },
    "strategieScoring": "ANALYSE_RH"
  },

  "scenarioParameters": {
    "periode": {
      "dateDebut": "2026-05-11",
      "dateFin": "2026-05-17"
    },
    "prioriteCouverture": "NORMALE"
  },

  "dataSet": {

    "referentiels": {
      "activites": [
        {
          "codeActiviteId": "ACT-SOIN",
          "libelle": "Soins infirmiers",
          "compteDansCharge": true,
          "genereDetteRepos": false,
          "estServiceCritique": true
        },
        {
          "codeActiviteId": "ACT-ADMIN",
          "libelle": "Administratif",
          "compteDansCharge": true,
          "genereDetteRepos": false,
          "estServiceCritique": false
        }
      ]
    },

    "creneaux": [
      {
        "id": "CRE-L-01",
        "date": "2026-05-11",
        "heureDebut": "07:00",
        "heureFin": "15:00",
        "lieu": "HOPITAL-NORD",
        "codeActiviteId": "ACT-SOIN",
        "activite": "Soins infirmiers",
        "posteComptable": "PC-SOINS",
        "groupeBesoinId": "BESOIN-SEMAINE-01",
        "blocJourId": "BLOC-LUNDI-MATIN",
        "ordreDansBloc": 1,
        "estSegmentDePause": false
      },
      {
        "id": "CRE-L-02",
        "date": "2026-05-11",
        "heureDebut": "14:00",
        "heureFin": "22:00",
        "lieu": "HOPITAL-NORD",
        "codeActiviteId": "ACT-SOIN",
        "activite": "Soins infirmiers",
        "posteComptable": "PC-SOINS",
        "groupeBesoinId": "BESOIN-SEMAINE-01",
        "blocJourId": "BLOC-LUNDI-SOIR",
        "ordreDansBloc": 1,
        "estSegmentDePause": false
      },
      {
        "id": "CRE-MA-01",
        "date": "2026-05-12",
        "heureDebut": "07:00",
        "heureFin": "15:00",
        "lieu": "HOPITAL-NORD",
        "codeActiviteId": "ACT-SOIN",
        "activite": "Soins infirmiers",
        "posteComptable": "PC-SOINS",
        "groupeBesoinId": "BESOIN-SEMAINE-01",
        "blocJourId": "BLOC-MARDI-MATIN",
        "ordreDansBloc": 1,
        "estSegmentDePause": false
      },
      {
        "id": "CRE-ME-01",
        "date": "2026-05-13",
        "heureDebut": "07:00",
        "heureFin": "15:00",
        "lieu": "HOPITAL-NORD",
        "codeActiviteId": "ACT-SOIN",
        "activite": "Soins infirmiers",
        "posteComptable": "PC-SOINS",
        "isJourFerie": true,
        "groupeBesoinId": "BESOIN-FERIE-01",
        "blocJourId": "BLOC-MERCREDI-MATIN",
        "ordreDansBloc": 1,
        "estSegmentDePause": false
      },
      {
        "id": "CRE-VN-01",
        "date": "2026-05-15",
        "heureDebut": "22:00",
        "heureFin": "06:00",
        "lieu": "HOPITAL-NORD",
        "codeActiviteId": "ACT-SOIN",
        "activite": "Soins infirmiers",
        "posteComptable": "PC-SOINS",
        "segmentNuit": true,
        "groupeBesoinId": "BESOIN-NUIT-01",
        "blocJourId": "BLOC-VENDREDI-NUIT",
        "ordreDansBloc": 1,
        "estSegmentDePause": false
      },
      {
        "id": "CRE-DI-01",
        "date": "2026-05-17",
        "heureDebut": "10:00",
        "heureFin": "18:00",
        "lieu": "HOPITAL-NORD",
        "codeActiviteId": "ACT-SOIN",
        "activite": "Soins infirmiers",
        "posteComptable": "PC-SOINS",
        "groupeBesoinId": "BESOIN-SEMAINE-01",
        "blocJourId": "BLOC-DIMANCHE-MATIN",
        "ordreDansBloc": 1,
        "estSegmentDePause": false
      }
    ],

    "ressources": {
      "salaries": [
        {
          "id": "SAL-2001",
          "statut": "CDI",
          "sitesAutorises": ["HOPITAL-NORD"],
          "activitesCompatibles": ["ACT-SOIN", "ACT-ADMIN"],
          "contraintesReglementaires": {
            "heuresMinimumParJour": 4.0,
            "heuresMaximumParJour": 10.0,
            "amplitudeJournaliereMaximum": 11.0,
            "reposQuotidienMinimum": 11.0,
            "heuresMinimumParSemaine": 35.0,
            "heuresMaximumParSemaine": 39.0,
            "nuitsMaximumParSemaine": 0,
            "joursConsecutifsMaximum": 5
          },
          "travailDeNuit": null,
          "travailleJourFerie": false
        },
        {
          "id": "SAL-2002",
          "statut": "CDI",
          "sitesAutorises": ["HOPITAL-NORD"],
          "activitesCompatibles": ["ACT-SOIN"],
          "contraintesReglementaires": {
            "heuresMinimumParJour": 4.0,
            "heuresMaximumParJour": 10.0,
            "amplitudeJournaliereMaximum": 13.0,
            "reposQuotidienMinimum": 11.0,
            "heuresMinimumParSemaine": 35.0,
            "heuresMaximumParSemaine": 44.0,
            "nuitsMaximumParSemaine": 3,
            "joursConsecutifsMaximum": 6
          },
          "travailDeNuit": "occasionnel",
          "heureDebutNuit": "22:00",
          "heureFinNuit": "06:00",
          "travailleJourFerie": true
        }
      ],
      "postesVirtuels": [
        {
          "id": "PV-001",
          "type": "POTENTIEL",
          "capaciteCible": 2400,
          "activitesAutorisees": ["ACT-SOIN"],
          "lieuxAutorises": ["HOPITAL-NORD"],
          "postesComptablesCompatibles": ["PC-SOINS"]
        }
      ]
    },

    "indisponibilites": {
      "items": [
        {
          "ressourceId": "SAL-2001",
          "dateDebut": "2026-05-13",
          "dateFin": "2026-05-13",
          "motif": "CONGE_POSE"
        }
      ]
    }
  }
}
